{
  "$schema": "https://json-schema.org/draft/2020-12/schema",
  "$id": "https://github.com/oso-gato/dev-pair/shared/contracts/lineage-manifest.v1.schema.json",
  "title": "lineage-manifest v1",
  "description": "The record of one agent-lineage admission decision against the P11 contract. Admission is a contract, not a name: every field is evidence, and a non-admission is recorded with its reason, never waived silently.",
  "type": "object",
  "additionalProperties": false,
  "required": ["grammar", "v", "name", "tool", "vendor", "provenance", "adopted", "last-live-check", "headless", "self-update-disabled", "state-outside", "policy-interface", "status"],
  "properties": {
    "grammar": { "const": "lineage-manifest" },
    "v": { "const": 1 },
    "name": {
      "type": "string",
      "minLength": 1,
      "description": "The box lineage name (claudebox, kimibox, ...). One box instance runs one lineage, chosen at provisioning."
    },
    "tool": {
      "type": "string",
      "minLength": 1,
      "description": "The vendor tool the layer carries (claude-code, kimi-code, ...)."
    },
    "vendor": { "type": "string", "minLength": 1 },
    "provenance": {
      "type": "object",
      "additionalProperties": false,
      "required": ["level", "pin", "source", "verification"],
      "properties": {
        "level": {
          "enum": ["L1", "L2", "L3"],
          "description": "The strongest provenance level the vendor admits (P1). L1: Fedora dnf repos. L2: vendor RPM/dnf repo with gpgcheck=1. L3: last-resort official-upstream binary, graded."
        },
        "grade": {
          "enum": ["c1", "c2", "c3"],
          "description": "L3 only — c1 GPG signature, c2 published checksum, c3 resolve-log. Required when level is L3; absent otherwise."
        },
        "pin": {
          "type": "string",
          "minLength": 1,
          "description": "The exact pinned version or digest admitted."
        },
        "source": {
          "type": "string",
          "minLength": 1,
          "description": "Where the artifact comes from — the vendor repo or upstream release URL."
        },
        "verification": {
          "type": "string",
          "minLength": 1,
          "description": "How identity is verified at fetch time — gpg key id, checksum mechanism, repo-metadata signature."
        }
      }
    },
    "adopted": {
      "type": "string",
      "format": "date",
      "description": "Adoption date (P2 adoption trail)."
    },
    "last-live-check": {
      "type": "string",
      "format": "date",
      "description": "Last date the source was fact-checked against the live upstream (P2)."
    },
    "headless": {
      "type": "string",
      "minLength": 1,
      "description": "How headless non-interactive autonomous operation is achieved, with evidence."
    },
    "self-update-disabled": {
      "type": "string",
      "minLength": 1,
      "description": "The construction that disables the tool's own self-update, so a self-installed binary can never shadow the managed one."
    },
    "state-outside": {
      "type": "array",
      "minItems": 1,
      "items": { "type": "string", "minLength": 1 },
      "description": "The persistent volumes holding everything durable — credentials, transcripts, configuration — outside the disposable layer."
    },
    "policy-interface": {
      "type": "string",
      "minLength": 1,
      "description": "How the loop's policy and permissions are enforced on this lineage."
    },
    "status": { "enum": ["admitted", "non-admitted"] },
    "reason": {
      "type": "string",
      "minLength": 1,
      "description": "Required when status is non-admitted: which contract clause failed."
    }
  },
  "allOf": [
    {
      "if": { "properties": { "status": { "const": "non-admitted" } } },
      "then": { "required": ["reason"] }
    },
    {
      "if": { "properties": { "provenance": { "properties": { "level": { "const": "L3" } }, "required": ["level"] } }, "required": ["provenance"] },
      "then": { "properties": { "provenance": { "required": ["level", "grade", "pin", "source", "verification"] } } }
    }
  ]
}
