{
  "grammar": "lineage-manifest",
  "v": 1,
  "name": "claudebox",
  "tool": "claude-code",
  "vendor": "Anthropic",
  "provenance": {
    "level": "L2",
    "pin": "claude-code (latest vendor repo release, pinned at build time)",
    "source": "Anthropic's own RPM repository",
    "verification": "dnf with gpgcheck=1 against Anthropic's published repo signing key"
  },
  "adopted": "2026-08-02",
  "last-live-check": "2026-08-02",
  "headless": "Runs non-interactively with credentials injected at runtime from the persistent volume; the box harness drives it without a TTY.",
  "self-update-disabled": "The layer runs the dnf-managed binary read-only; the tool's self-update channel is disabled in its managed configuration so no self-installed binary can shadow the managed one.",
  "state-outside": ["/var/lib/agent-state/claudebox"],
  "policy-interface": "The box harness constrains the tool's permission profile to the session's declared scope before launch.",
  "status": "admitted"
}
