{
  "grammar": "lineage-manifest",
  "v": 1,
  "name": "kimibox",
  "tool": "kimi-code",
  "vendor": "Moonshot AI",
  "provenance": {
    "level": "L3",
    "grade": "c2",
    "pin": "kimi-code (release pinned by digest at build time)",
    "source": "MoonshotAI/kimi-code official release channel",
    "verification": "Published checksum verified by the platform's one pinned-fetch contract; never curl-pipe-sh, never npm"
  },
  "adopted": "2026-08-02",
  "last-live-check": "2026-08-02",
  "headless": "Runs non-interactively with the API key injected at runtime from the persistent volume; 'kimi upgrade' self-update is disabled by construction.",
  "self-update-disabled": "The managed binary is read-only inside the layer and the self-update subcommand is disabled in managed configuration; a self-installed copy could not persist outside the disposable layer.",
  "state-outside": ["/var/lib/agent-state/kimibox"],
  "policy-interface": "The box harness constrains the tool's permission profile to the session's declared scope before launch.",
  "status": "admitted"
}
