{
  "grammar": "lineage-manifest",
  "v": 1,
  "name": "examplebox",
  "tool": "example-tool",
  "vendor": "Example Vendor",
  "provenance": {
    "level": "L3",
    "grade": "c3",
    "pin": "0.0.0",
    "source": "vendor download page",
    "verification": "resolve-log only — no published signature or checksum"
  },
  "adopted": "2026-08-03",
  "last-live-check": "2026-08-03",
  "headless": "Unverified.",
  "self-update-disabled": "No mechanism found.",
  "state-outside": ["/var/lib/agent-state/examplebox"],
  "policy-interface": "None found.",
  "status": "non-admitted",
  "reason": "Fails the P11 contract: provenance only admits grade c3 (resolve-log) with no stronger channel, no self-update disable mechanism, and no policy/permissions interface. Recorded non-admission, not a waiver."
}
